{
  "exportType": "storylab_project",
  "schemaVersion": "0.8.0-alpha.1",
  "exportedAt": "2026-07-15T14:00:00Z",
  "project": {
    "schemaVersion": "0.8.0-alpha.1",
    "id": "project-synthetic-002",
    "title": "Cartas desde la luna verde",
    "status": "completed",
    "profile": {
      "pseudonym": "Brisa",
      "context": "Taller creativo sintético",
      "accessibility": {
        "reducedMotion": false,
        "highContrast": false,
        "textScale": "default"
      }
    },
    "missions": [
      {
        "missionId": "mission-intention",
        "status": "completed",
        "startedAt": "2026-07-15T13:00:00Z",
        "completedAt": "2026-07-15T13:30:00Z"
      }
    ],
    "activityResponses": [],
    "evidence": [
      {
        "id": "evidence-synthetic-001",
        "missionId": "mission-intention",
        "title": "Premisa narrativa",
        "kind": "text",
        "summary": "Una exploradora recibe cartas de una luna que recuerda.",
        "status": "accepted_for_portfolio",
        "createdAt": "2026-07-15T13:20:00Z"
      }
    ],
    "reflections": [
      {
        "id": "reflection-synthetic-001",
        "missionId": "mission-intention",
        "text": "Elegí conservar la decisión final y revisar la sugerencia externa.",
        "privacyClass": "exportable_after_review",
        "selectedForExport": true,
        "createdAt": "2026-07-15T13:22:00Z"
      }
    ],
    "decisions": [
      {
        "id": "decision-synthetic-001",
        "evidenceId": "evidence-synthetic-001",
        "actor": "human_user",
        "value": "accept",
        "rationale": "Representa mi intención creadora.",
        "decidedAt": "2026-07-15T13:25:00Z"
      }
    ],
    "portfolio": {
      "items": [
        {
          "id": "portfolio-item-synthetic-001",
          "evidenceId": "evidence-synthetic-001",
          "title": "Premisa narrativa",
          "order": 0,
          "includedAt": "2026-07-15T13:26:00Z"
        }
      ]
    },
    "featureFlags": {
      "facilitatorView": false,
      "groupDashboard": false,
      "embeddedAI": false,
      "cloudSync": false,
      "analytics": false,
      "autoPublish": false,
      "realData": false
    },
    "createdAt": "2026-07-15T12:00:00Z",
    "updatedAt": "2026-07-15T13:30:00Z"
  }
}
